id,title,authors,type,venue,year,acceptance,note,abstract,pubmed2011a,Neuroendocrinology of parental response to baby-cry,"Jame E. Swain, Pilyoung Kim, S. Ho",Journal Paper,Journal of Neuroendocrinology,2011,,,This is an abstract of this paper.,2011b,"Breastfeeding, Brain Activation to Own Infant Cry, and Maternal Sensitivity","Pilyoung Kim, Ruth Feldman, Linda Mayes, V. Eicher, N. Thompson, James F. Leckman, James E. Swain",Journal Paper,Journal of Child Psychology and Psychiatry,2011,,,"Research points to the importance of breastfeeding for promoting close mother infant contact and social-emotional development. Recent functional magnetic resonance imaging (fMRI) studies have identified brain regions related to maternal behaviors. However, little research has addressed the neurobiological mechanisms underlying the relationship between breastfeeding and maternal behavior in human mothers. We investigated the associations between breastfeeding, maternal brain response to own infant stimuli, and maternal sensitivity in the early postpartum.",http://www.ncbi.nlm.nih.gov/pubmed/215011652010a,The plasticity of human maternal brain: longitudinal changes in brain anatomy during the early postpartum period,"Pilyoung Kim, James F. Leckman, Linda C. Mayes, Ruth Feldman, X. Wang, James E. Swain",Journal Paper,Behaviorial Neuroscience,2010,,,This is an abstract of this paper.,2009a,The Built Environment and Children,"Gary Evans, Pilyoung Kim",Book Chapter,The Chicago Companion to the Child,2009,,,This is an abstract of this paper.,2011c,"Family resources, genes, and human development","Pilyoung Kim, Gary Evans",Book Chapter,Biosocial Research Contributions to Understanding Family Processes and Problems,2011,,,This is an abstract of this paper.,2011d,Neural Correlates of Cognitive Flexibility in Children At Risk for Bipolar Disorder,"Pilyoung Kim, S. E. Jenkins, M. E. Connolly, C. M. Deveney, C. M., S. J. Fromm, M. A. rotman, E. E. Nelson, D. S. Pine, E. Leibenluft",Journal Paper,Journal of Psychiatric Research,2011,,,This is an abstract of this paper.,